{
  "schemaVersion": "1.0",
  "attestationId": "EXAMPLE-UNTRUSTED-TIME",
  "profileId": "JAPAN_PUBLIC_CROSS_PLATFORM_MAINNET_V1",
  "sequence": 0,
  "observedAt": "2026-07-28T11:10:00Z",
  "validUntil": "2026-07-28T11:15:00Z",
  "trusted": false,
  "authority": {
    "keyId": "EXAMPLE-TIME-UNTRUSTED",
    "role": "TRUSTED_TIME_AUTHORITY",
    "principalId": "EXAMPLE-TIME-PRINCIPAL",
    "organization": "EXAMPLE ONLY"
  },
  "signature": {
    "profile": "ONE_INTENT_ED25519_CANONICAL_JSON_V2",
    "keyId": "EXAMPLE-TIME-UNTRUSTED",
    "signatureBase64": "AA=="
  }
}
